{"analysis_order":["market_summary","key_observations","data_quality"],"claim_plan_version":"crypto-market-claim-plan/v1","evidence_bundle_id":"sha256:cac65904dcff4656ee84ca9be906390a5219ad6b7dff3d2d546ccc69028feda3","prompt_version":"crypto-market-claim-plan/v1","sections":[{"claims":[{"claim_id":"claim-cfd7709eedb67dd80a2dcded3ddfeeaa6889df620de410329f662681a9423728","comparison_relation":"none","confidence":"high","evidence_ids":["market.asset.bitcoin.price_usd"],"intent":"absolute_observation"}],"section_kind":"market_summary"},{"claims":[{"claim_id":"claim-569d50b55ed2fce91d5fb0b8c06f82ea6354420bce32230cf35a9a3cb2b928e0","comparison_relation":"none","confidence":"high","evidence_ids":["market.asset.solana.change_24h_pct"],"intent":"directional_observation"},{"claim_id":"claim-7fba1f4e9aeb6531bda575f2f9aa6e517bafe5142fdb3f0bff3bb79ebc6c9238","comparison_relation":"opposite_direction","confidence":"high","evidence_ids":["market.asset.bitcoin.change_1h_pct","market.asset.ethereum.change_1h_pct"],"intent":"comparison"},{"claim_id":"claim-9573f39667e82c618f9980bcd6eca82f47dd71c34777646ef1ae0ef35e31d6da","comparison_relation":"greater_than","confidence":"high","evidence_ids":["market.asset.bitcoin.price_usd","market.asset.ethereum.price_usd"],"intent":"comparison"}],"section_kind":"key_observations"},{"claims":[{"claim_id":"claim-79315d64dbe4abd9700f01bfd84e1188ffcbe391bd2f107a76c808a1454881fb","comparison_relation":"none","confidence":"high","evidence_ids":["source.binance.reason","source.binance.status"],"intent":"data_quality_limitation"}],"section_kind":"data_quality"}]}
